{
  "$schema": "https://raw.githubusercontent.com/huangfanwei25-lang/tonesoul52/master/spec/governance/public_current_index_v0.schema.json",
  "format": "tonesoul/public-current-index-v0",
  "artifact_type": "public_current_projection",
  "as_of": "2026-07-22",
  "reviewed_revision": "892d2dcf82069046c4d2d06723762ac7fe503b20",
  "canonical": {
    "human": "https://huangfanwei25-lang.github.io/tonesoul52/current/",
    "machine": "https://huangfanwei25-lang.github.io/tonesoul52/current.json"
  },
  "projection": {
    "kind": "public_navigation",
    "derived": true,
    "writable": false,
    "source_of_truth": false
  },
  "project": {
    "name": "ToneSoul / 語魂",
    "summary_zh": "ToneSoul 是 AI 輸出治理與問責層；它讓分歧、邊界、證據與失敗更可檢查，但不使模型成為真理來源。",
    "summary_en": "ToneSoul is an accountability layer for AI output. It makes dissent, boundaries, evidence, and failures more inspectable; it does not make a model a source of truth."
  },
  "scope": {
    "includes": [
      "Reviewed public orientation and source routing",
      "Distinct lanes for repository intent, runtime source, tests, generated measurements, and historical context",
      "Public entrypoints for reading, reviewing, trying, and challenging ToneSoul"
    ],
    "excludes": [
      "Private continuity data and personal context",
      "Raw dialogue, hidden reasoning, system prompts, credentials, and private operating thresholds",
      "A new axiom, runtime capability, maturity verdict, or cross-repository event ledger"
    ]
  },
  "sources": [
    {
      "id": "public-readme",
      "projection_role": "canonical_intent",
      "locator": "README.md",
      "revision": "892d2dcf82069046c4d2d06723762ac7fe503b20"
    },
    {
      "id": "public-readme-zh",
      "projection_role": "canonical_intent",
      "locator": "README.zh-TW.md",
      "revision": "892d2dcf82069046c4d2d06723762ac7fe503b20"
    },
    {
      "id": "positioning",
      "projection_role": "canonical_intent",
      "locator": "docs/POSITIONING.md",
      "revision": "892d2dcf82069046c4d2d06723762ac7fe503b20"
    },
    {
      "id": "design",
      "projection_role": "canonical_intent",
      "locator": "DESIGN.md",
      "revision": "892d2dcf82069046c4d2d06723762ac7fe503b20"
    },
    {
      "id": "axioms",
      "projection_role": "canonical_intent",
      "locator": "AXIOMS.json",
      "revision": "892d2dcf82069046c4d2d06723762ac7fe503b20"
    },
    {
      "id": "unified-pipeline",
      "projection_role": "runtime_source",
      "locator": "tonesoul/unified_pipeline.py",
      "revision": "892d2dcf82069046c4d2d06723762ac7fe503b20"
    },
    {
      "id": "council-runtime",
      "projection_role": "runtime_source",
      "locator": "tonesoul/council/runtime.py",
      "revision": "892d2dcf82069046c4d2d06723762ac7fe503b20"
    },
    {
      "id": "council-types",
      "projection_role": "runtime_source",
      "locator": "tonesoul/council/types.py",
      "revision": "892d2dcf82069046c4d2d06723762ac7fe503b20"
    },
    {
      "id": "council-runtime-tests",
      "projection_role": "test",
      "locator": "tests/test_council_runtime.py",
      "revision": "892d2dcf82069046c4d2d06723762ac7fe503b20"
    },
    {
      "id": "council-evidence-chain-tests",
      "projection_role": "test",
      "locator": "tests/test_council_evidence_chain.py",
      "revision": "892d2dcf82069046c4d2d06723762ac7fe503b20"
    },
    {
      "id": "pipeline-runtime-tests",
      "projection_role": "test",
      "locator": "tests/test_unified_pipeline_v2_runtime.py",
      "revision": "892d2dcf82069046c4d2d06723762ac7fe503b20"
    },
    {
      "id": "evidence-ladder",
      "projection_role": "canonical_intent",
      "locator": "docs/architecture/TONESOUL_EVIDENCE_LADDER_AND_VERIFIABILITY_CONTRACT.md",
      "revision": "892d2dcf82069046c4d2d06723762ac7fe503b20"
    },
    {
      "id": "status-lane-policy",
      "projection_role": "canonical_intent",
      "locator": "docs/status/README.md",
      "revision": "892d2dcf82069046c4d2d06723762ac7fe503b20"
    },
    {
      "id": "observable-shell",
      "projection_role": "canonical_intent",
      "locator": "docs/architecture/TONESOUL_OBSERVABLE_SHELL_OPACITY_CONTRACT.md",
      "revision": "892d2dcf82069046c4d2d06723762ac7fe503b20"
    },
    {
      "id": "receiver-boundary",
      "projection_role": "canonical_intent",
      "locator": "docs/architecture/TONESOUL_RECEIVER_INTERPRETATION_BOUNDARY_CONTRACT.md",
      "revision": "892d2dcf82069046c4d2d06723762ac7fe503b20"
    },
    {
      "id": "distillation-boundary",
      "projection_role": "canonical_intent",
      "locator": "docs/architecture/TONESOUL_L8_DISTILLATION_BOUNDARY_CONTRACT.md",
      "revision": "892d2dcf82069046c4d2d06723762ac7fe503b20"
    },
    {
      "id": "principle-engineering",
      "projection_role": "canonical_intent",
      "locator": "docs/philosophy/principle_engineering.md",
      "revision": "892d2dcf82069046c4d2d06723762ac7fe503b20"
    },
    {
      "id": "successor-map",
      "projection_role": "canonical_intent",
      "locator": "docs/SUCCESSOR_MAP.md",
      "revision": "892d2dcf82069046c4d2d06723762ac7fe503b20"
    },
    {
      "id": "lineage",
      "projection_role": "historical_context",
      "locator": "docs/LINEAGE.md",
      "revision": "892d2dcf82069046c4d2d06723762ac7fe503b20"
    },
    {
      "id": "static-site-boundary",
      "projection_role": "canonical_intent",
      "locator": "site/README.md",
      "revision": "892d2dcf82069046c4d2d06723762ac7fe503b20"
    },
    {
      "id": "pages-deployment",
      "projection_role": "runtime_source",
      "locator": ".github/workflows/pages.yml",
      "revision": "892d2dcf82069046c4d2d06723762ac7fe503b20"
    }
  ],
  "source_routes": [
    {
      "id": "accountability-layer",
      "question_zh": "ToneSoul 現在如何公開定義？",
      "question_en": "How is ToneSoul currently defined in public?",
      "summary_zh": "ToneSoul 是 AI 輸出治理與問責層；它讓分歧、邊界、證據與失敗更可檢查，但不使模型成為真理來源。",
      "summary_en": "ToneSoul is an accountability layer for AI output. It makes dissent, boundaries, evidence, and failures more inspectable; it does not make a model a source of truth.",
      "source_refs": ["public-readme", "public-readme-zh", "positioning"],
      "caveats_zh": ["這是專案定位與可觀察表面的有界描述，不是答案正確性或安全性的保證。"],
      "caveats_en": ["This is a bounded description of project posture and observable surfaces, not a guarantee of answer correctness or safety."]
    },
    {
      "id": "philosophical-compass",
      "question_zh": "工程收斂時，哪些方向不應被抹平？",
      "question_en": "Which directions should engineering convergence not flatten?",
      "summary_zh": "語魂以保留張力、選擇先於身份與語義責任作為設計羅盤；它們約束怎麼設計，不是假裝已取得的新能力。",
      "summary_en": "ToneSoul uses preserved tension, choice before identity, and semantic responsibility as design bearings; they constrain how the system is built rather than pretending to be acquired capabilities.",
      "source_refs": ["axioms", "positioning", "principle-engineering"],
      "caveats_zh": ["哲學方向可以要求工程留下可檢查結構，但不能替代 runtime、測試或效果證據。"],
      "caveats_en": ["Philosophical direction can require inspectable engineering structure, but it cannot replace runtime, tests, or outcome evidence."]
    },
    {
      "id": "bounded-mechanisms",
      "question_zh": "哪些機制可從倉庫直接檢查？",
      "question_en": "Which mechanisms can be inspected directly in the repository?",
      "summary_zh": "倉庫中已有 Council、輸出邊界與 evidence-chain 相關的執行路徑與測試。",
      "summary_en": "The repository contains runtime paths and tests for Council, output boundaries, and evidence-chain mechanisms.",
      "source_refs": ["unified-pipeline", "council-runtime", "council-types", "council-runtime-tests", "council-evidence-chain-tests", "pipeline-runtime-tests"],
      "caveats_zh": ["機制存在與測試通過，不足以證明一般情境下的回答品質、校準或防越獄能力。"],
      "caveats_en": ["Mechanism presence and passing tests do not establish general answer quality, calibration, or jailbreak resistance."]
    },
    {
      "id": "evidence-lanes-stay-distinct",
      "question_zh": "不同來源應如何閱讀？",
      "question_en": "How should different source lanes be read?",
      "summary_zh": "設計意圖、runtime source、測試與有日期的生成測量必須分開閱讀；latest 檔名不會把測量升格成架構真理。",
      "summary_en": "Design intent, runtime source, tests, and dated generated measurements must be read separately; a latest filename does not promote a measurement into architecture truth.",
      "source_refs": ["evidence-ladder", "status-lane-policy", "receiver-boundary"],
      "caveats_zh": ["本索引只指向來源，不替來源重新評分，也不保證所有生成測量仍新鮮。"],
      "caveats_en": ["This index routes to sources; it does not rescore them or guarantee that every generated measurement remains fresh."]
    },
    {
      "id": "artifact-continuity-boundary",
      "question_zh": "跨模型能延續的是什麼？",
      "question_en": "What can continue across models?",
      "summary_zh": "跨模型可承接的是經授權的紀錄、Artifact 與公開規則；不能據此推定模型權重記憶或持續的主觀自我。",
      "summary_en": "What can cross models is authorized records, artifacts, and public rules; this does not establish model-weight memory or a persistent subjective self.",
      "source_refs": ["design", "observable-shell", "receiver-boundary", "distillation-boundary", "lineage"],
      "caveats_zh": ["跨 session 脈絡保存的實際效果仍需要 outcome measurement，而不是只看檔案存在。"],
      "caveats_en": ["Effective cross-session context preservation still requires outcome measurement, not merely the presence of files."]
    },
    {
      "id": "public-projection-boundary",
      "question_zh": "哪些資訊可以進入公開投影？",
      "question_en": "Which information may enter the public projection?",
      "summary_zh": "可讀取不等於獲准公開；現行索引只投影已審查的公開資訊，不搬運私人歷史。",
      "summary_en": "Readable does not mean authorized for publication; the current index projects reviewed public information without transporting private history.",
      "source_refs": ["receiver-boundary", "distillation-boundary", "observable-shell"],
      "caveats_zh": ["這項邊界依賴維護者在每次更新時重新檢查來源、連結與最小揭露範圍。"],